{
  "$schema": "../../schemas/data-contract-sql-v1.json",
  "schemaVersion": "1",
  "target": "postgres",
  "targetFamily": "sql",
  "storageHash": "sha256:test-core",
  "profileHash": "sha256:test-profile",
  "models": {
    "User": {
      "storage": { "table": "user" },
      "fields": {
        "id": { "column": "id" },
        "email": { "column": "email" },
        "createdAt": { "column": "createdAt" },
        "deletedAt": { "column": "deletedAt" }
      },
      "relations": {}
    }
  },
  "storage": {
    "tables": {
      "user": {
        "columns": {
          "id": {
            "nativeType": "int4",
            "codecId": "pg/int4@1",
            "nullable": false
          },
          "email": {
            "nativeType": "text",
            "codecId": "pg/text@1",
            "nullable": false
          },
          "createdAt": {
            "nativeType": "timestamptz",
            "codecId": "pg/timestamptz@1",
            "nullable": false
          },
          "deletedAt": {
            "nativeType": "timestamptz",
            "codecId": "pg/timestamptz@1",
            "nullable": true
          }
        },
        "primaryKey": {
          "columns": ["id"]
        },
        "uniques": [],
        "indexes": [],
        "foreignKeys": []
      }
    }
  },
  "extensions": {},
  "capabilities": {
    "postgres": {
      "returning": true
    }
  }
}
